product_name,description_1,description_2,download_link,Categories,Brands,URL
NF Series Mitsubishi MCCB,"Molded-case circuit breakers are used to open/close low-voltage circuits and protect wiring by automatically closing circuits when they’re overloaded or if a short-circuit occurs. We offer an economy, standard, high performance and current limiting breaker suitable for virtually every application. Specification Molded Case Circuit Breakers (50 -100AF) Frame Size (A) 50 100 Model Number NF50-SMU NF50-SVFU NF100-CVFU NF100-SRU NF100-HRU Stocked Item S S S S S – – – – S S Rated Current in Amps at Ambient Temperature 40°C (IEC 30°C) 0.5 1(1.5) 2 3 4 5(6) 7 (8) 10 13 15 20(25) 30 (35) (40) 50 (0.5 ) (1)(1.5) (2) (3) 4 5 (6)(7) (8) 10 13 15 20 25 30 (35) 40 50 (3) 5 10 15 20 30 40 50 60 (70) 75 (80) (90) 100 (1) (2) 3 5 10 15 20 (25) 30 40 50 60 (70) 75 (80) (90) 100 (1) (2) 3 5 10 15 20 (25) 30 40 50 60 (70) 75 (80) (90) 100 Number of Poles 1 2 3 2 3 2 3 2 3 2 3 Rated Voltage AC (V) 240 240 240 240 480 DC (V) 60 – – – – – UL489 (File No. E108284) CSA C22.2No. 5-02 AC 600Y / 347V – – – – – 480V – – – – 18 (10) 480Y / 277V – – – – – 240V 5 10 14 14 35 50 (25) 120V 10 – – – – – DC 60V 10 – – – – – Rated Insulation Voltage (Ui) V 440 440 600 500 500 JIS C8201-2-1 Ann.1 IEC60947-2 EN60947-2 (Icu/Ics) AC 690V – – – – – 500V – – 7.5/4 10/5 18/9 (10/5) 440V – 7.5/4 10/5 15/8 25/13 (15/8) 415V – 10/5 10/5 15/8 25/13 (15/8) 400V – 10/7.5 10/5 10/5 15/8 25/13 (15/8) 380V – 10/5 10/5 – – 230V 10/7.5 10/7.5 15/8 15/8 35/18 (25/13) 50/25 (25/13) DC 250V – – – – – 60V 10/7.5 – – – – – Overall Dimensions mm (in) Width 18 36 54 36 54 50 75 50 75 50 75 Height 124 120 150 120 120 Depth 44 68 68 68 74 Depth Including Knob 70 90 90 90 102 External Handles F-Type – 2P: F-03SVUL23P:F-03SVUL 2P: F-05SVUL23P:F-05SVUL 2P: F-05SRUL2 3P: F-05SRUL V-Type – 2P: V-03SVUL23P: V-03SVU 2P: V-05SVUL23P: V-05SVUL 2P: V-05SRUL23P: V-05SRUL C-Type 3P: C1SVU Handle Lock HL HLF-05SMU HLF-03SVU HLF-05SVU HLF-05SRU HL-S – HLS-03SVU 2P: HLS-05SVU23P: HLS-05SVU 2P: HLS-05SRU23P: HLS-05SRU3 Terminal Covers (TCL, TCS) – 2P: TCL-03SVU23P: TCL-03SVU3 2P: TCL-05SVU2,TCL-05SVU2L3P: TCL-05SVU3,TCL-05SVU3L 2P: TCS-05SRU2, TCL-05SRU23P: TCS-05SRU3, TCL-05SRU3TCG-05SRU Note: V-Type handles require a separate extension shaft, V-AD3S for 50AF to 250AF MCCB and the V-AD3L for 400AF to 630AF MCCB. Molded Case Circuit Breakers (125 – 225AF) Frame Size (A) 125 225 250 Model Number NF125-SVU NF125-HVU NF225-CWU Stocked Item S S S S S S – – Rated Current in Amps at Ambient Temperature 40°C (IEC 30°C) 15 20 30 40 50 60 (70) 75 (80) (90) 100 125 15 20 30 40 50 60 (70) 75 (80)(90) 100 125 125 150 175 200 225 (250) Number of Poles 2 3 2 3 3 3 3 3 Rated Voltage AC (V) 480 480 600Y/347 240 240 DC (V) – – – – – UL489 (File No. E108284)CSA C22.2No. 5-02 AC 600Y / 347V – – 18 – – 480V 30 30 50 – – 480Y / 277V – – – – – 240V 50 50 100 35 35 120V – – – – – DC 60V – – – – – Rated Insulation Voltage (Ui) V 690 690 690 600 600 JIS C8201-2-1 Ann.1IEC60947-2EN60947-2(Icu/Ics) AC 690V 8/4 8/4 10/5 – – 500V 18/9 18/9 25/13 10/5 – 440V 30/15 30/15 50/25 15/8 15/8 415V 30/15 30/15 50/25 18/9 18/9 400V 30/15 30/15 50/25 18/9 18/9 380V 30/15 30/15 50/25 18/9 18/9 230V 50/25 50/25 100/25 35/18 35/18 DC 250V – – – 10/5 10/5 60V – – – – – Overall Dimensions mm (in) Width 90 90 90 105 105 Height 160 160 160 165 165 Depth 68 68 68 68 68 Depth Including Knob 90 90 90 92 92 External Handles F-Type F-1SVUL F-2SUL V-Type V-1SVUL V-2SUL S-Type – S2SWU C-Type C1SVU C2SWU Handle Lock HL HLF-05SVU HLF-2SWU HL-S HLS-05SVU HLS-2SWU Mechanical Interlock – MI-05SWU3 Terminal Cover TCL-1SVU3 TCL-2SWU3, TCL-2SWU3L  Molded Case Circuit Breakers (250AF – 630AF) Frame Size (A) 250 400 630 Model Number NF250-SVU NF250-HVU NF400-SWU NF400-HWU NF630-SWU NF630-HWU Stocked Item S S S S S S S S Rated Current in Amps at Ambient Temperature 40°C (IEC 30°C) 125 150 175 200 225 250 125 150 175 200 225 250 250 300 350 400 250 300 350 400 500 600 630 500 600 630 Number of Poles 3 3 3 3 3 3 3 3 Rated Voltage AC (V) 480 600Y/347 600Y/347 600Y/347 DC (V) – – – – UL489 (File No. E108284)CSA C22.2No. 5-02 AC 600Y / 347V – 18 20 25 20 25 480V 35 50 35 65 35 65 480Y / 277V – – – – 240V 65 100 65 100 85 100 120V – – – – DC 60V – – – – Rated Insulation Voltage (Ui) V 690 690 690 690 JIS C8201-2-1 Ann.1IEC60947-2EN60947-2(Icu/Ics) AC 690V 8/4 10/5 10/10 (5/5) 15/10 10/10 15/10 500V 25/13 36/18 30/30 (25/25) 42/42 30/30 42/42 440V 36/18 50/25 42/42 (36/36) 65/65 42/42 65/65 415V 36/18 50/25 45/45 (36/36) 70/70 45/45 70/70 400V 36/18 50/25 45/45 (36/36) 70/70 45/45 70/70 380V 36/18 50/25 50/50 (42/42) 70/70 50/50 70/70 230V 65/33 100/50 85/85 (65/65) 100/100 85/85 100/100 DC 250V – – – – 60V – – – – Overall Dimensions (mm) Width 105 105 140 210 Height 185 185 257 275 Depth 68 68 103 103 Depth Including Knob 92 92 155 155 External Handles F-Type F-2SVUL F-4SUL F-6SUL V-Type V-2SVUL V-4SUL V-6SUL C-Type C2SVU C4SWU – Handle Lock HL HLF-05SVU HL-4SWU HL-4SWU HL-S HLS-2SVU HLS-2SVU – Terminal Cover TCL-2SVU3, TCL-2SVU3L TCL-4SWU TCL-6SWU Note: V-Type handles require a separate extension shaft, V-AD3S for 50AF to 250AF MCCB and the V-AD3L for 400AF to 630AF MCCB",,https://dl.mitsubishielectric.com/dl/fa/document/catalog/lvcb/yn-c-0720/y0720f2102.pdf,Molded case circuit breaker,,https://ntntech.vn/en/industrial-electrical-equipment/lv-distribution/molded-case-circuit-breaker/nf-series-mitsubishi-mccb/
NV Series Mitsubishi Earth-Leakage Circuit Breakers,"Earth leakage circuit breaker:ELCB is a molded case circuit breaker used in a low voltage AC circuit to provide electrical shock protection and prevent fires from leakage current.As a general abbreviation, ELCB in our model name is denoted as “NV”. Specification ELCB is defined as a “device with integrated ground fault detector, tripping device and switch mechanism in an insulated body, and automatically shuts off the electric current in the event of a ground fault”.  Even with the inverter circuit with digital filter circuit, a part with the sensitivity current as a general circuit can be selected.   A DPDC surge discriminating circuit is incorporated. It is judged as a ground fault and the circuit breaker functions only when the ground fault current polarity alternates with the positive/negative poles for a set time. Thus, the circuit breaker operates accurately without incorrectly tripping at a lightning surge, etc.  The type AC corresponds to typical alternating current leakage currents. In an electronic circuit such as an inverter or servo, it the rectifying circuit fails, an earth leakage current with a half-wave rectified waveform or a phase-controlled waveform might be generated. In this case, type A earth leakage protection characteristics are needed to detect the half-wave rectified or half-wave phase-controlled earth leakage current waveform.Then type A leakage protection characteristics is equipped with CE marked and UL489 listed ELCBs up to 250A. (except for NV30-CS)  With 2-3mA passing current, human starts to feel current, but not dangerous even when continued. With 5-30mA passing current, human has trouble breathing or blood pressure rises. Several minutes is the limit. Some 100mA-some A ground fault current causes arc ground fault. Finally it heats and causes the building materials to ignite fires.ELCB 15mA-30mA high speed type can protect electric shock accident. Also ELCB some 100mA can protect the fires.",,https://dl.mitsubishielectric.com/dl/fa/document/catalog/lvcb/yn-c-0720/y0720f2102.pdf,Earth-Leakage Circuit Breakers,,https://ntntech.vn/en/industrial-electrical-equipment/lv-distribution/earth-leakage-circuit-breakers/nv-series-mitsubishi-earth-leakage-circuit-breakers-2/
Cosel TAC series EMI Filter,Three phase 500VAC　4-300AGeneral purpose　Low profileHigh-attenuation type from 150kHz to MHz1-stage filter 4-30APush down type terminal block 4-300AMaximum input voltage 528VAC: 10% fluctuations in voltage 480VACSelectable leakage current value Model List Three phase 500VAC　4AGeneral purpose　Low profileHigh-attenuation type from 150kHz to 1MHz1-stage filter  Three phase 500VAC　6AGeneral purpose　Low profileHigh-attenuation type from 150kHz to 1MHz1-stage filter  Three phase 500VAC　10AGeneral purpose　Low profileHigh-attenuation type from 150kHz to 1MHz1-stage filter  Three phase 500VAC　20AGeneral purpose　Low profileHigh-attenuation type from 150kHz to 1MHz1-stage filter  Three phase 500VAC　30AGeneral purpose　Low profileHigh-attenuation type from 150kHz to 1MHz1-stage filter  Three phase 500VAC　50AGeneral purpose　Low profileHigh-attenuation type from 150kHz to 1MHz1-stage filter  Three phase 500VAC 60AGeneral purpose　Low profileHigh-attenuation type from 150kHz to 1MHz1-stage filter  Three phase 500VAC　80AGeneral purpose　Low profileHigh-attenuation type from 150kHz to 1MHz1-stage filter  Three phase 500VAC　100AGeneral purpose　Low profileHigh-attenuation type from 150kHz to 1MHz1-stage filter  Three phase 500VAC　150AGeneral purpose　Low profileHigh-attenuation type from 150kHz to 1MHz1-stage filter  Three phase 500VAC　200AGeneral purpose　Low profileHigh-attenuation type from 150kHz to 1MHz1-stage filter  Three phase 500VAC　250AGeneral purpose　Low profileHigh-attenuation type from 150kHz to 1MHz1-stage filter  Three phase 500VAC　300AGeneral purpose　Low profileHigh-attenuation type from 150kHz to 1MHz1-stage filter,,https://en.cosel.co.jp/tool/tag/pdf/SFE_TAC-S.pdf,EMI Filter,,https://ntntech.vn/en/industrial-electrical-equipment/emi-filter/cosel-tac-series-2/
Oriental Motor World K Series – Induction Motor,"Parallel Shaft Gear, Right-Angle Gear or Round Shaft and 2-Pole, High Speed Motors Lead Wire, Terminal Box or Conduit Box Types Three-Phase 200-230 VAC Electromagnetic Brake Option (6 W to 40 W) Specification  Order Code  Model List",,,AC Motors & Gears,,https://ntntech.vn/en/motor-and-drivers/ac-motors-gears/oriental-motor-world-k-series-induction-motor/
Sanyo Denki SANMOTION R,"High-performance AC servo systems consisting of servo amplifiers with advanced vibration suppression and highly efficient servo motors. High resolution encoders improve trajectory accuracy and position repeatability by dramatically improving responsiveness. By providing optimal performance, this is a key component for reducing cycle time and improving production efficiency. Specification R2 Servo Motor wide inertia lineup. They are ideal for use in equipment such as robots, injection molding machines, and general industrial machinery. R1 Servo Motors are low inertia servo motors with low inertia and high acceleration for agile operation. These are ideal for inspection equipment. R5 Servo motors are medium inertia servo motors that are ideal for smooth operation. More evolved AC servo amplifiers that provide improved basic performance including high responsiveness, and pursue eco-efficiency and ease of use.” title=”More evolved AC servo amplifiers that provide improved basic performance including high responsiveness, and pursue eco-efficiency and ease of use. The encoder has no batteries, which have limited service lives, so it can be maintenance free. It is ideal for transportation equipment and industrial equipment needing high accuracy, such as machine tools, injection molding machines, and robots. Battery replacement maintenance is not needed, so manpower and time are significantly reduced. The number of divisions in a revolution is up to 8,388,608 (23 bit).This enables fine equipment control. Model List Model no. Product name Motor flange size[mm] Rated output[kW] Encoder type",,https://www.sanyodenki.com/archive/document/product/servo/catalog_E_pdf/SANMOTION_R-3E-AD_E.pdf,Servo Motors,,https://ntntech.vn/en/motor-and-drivers/servo-motors/sanyo-denki-sanmotion-r/
Oriental Motor BMU Series Brushless DC Motors,"The BMU Series features a compact, high-power and high-efficiency brushless DC motor and is combined with an easy to use, easy to set speed controller. The entire motor structure features our latest brushless DC motor technology and has been innovated in pursuit of the optimal performance. The BMU Series has a maximum speed of 4000 r/min. Speed ratio of 1:50 (80 to 4000 r/min) is achieved. Featuring 30 W (1/25 HP), 60 W (1/12 HP), 120 W (1/6 HP), 200 W (1/4 HP), 300 W (2/5 HP) and 400 W (1/2 HP) output power models. Speed Control Range: 80 ~ 4000 r/min Easy Wiring, Easy Set Up and Simple to Use Controls Parallel Shaft, Right-Angle Hollow Shaft Gear, Hollow Shaft Flat Gear or Round Shaft (no Gear)H1 Food-Grade Grease-Compatible gear motors available. H1 Food-Grade Grease-Compatible gear motors available. Imperial or Metric Shafts Available IP65, IP66 and IP67 Types Available Specification   Order Code  Model List BMU230A-10BMU230A-100BMU230A-100-1BMU230A-100-2BMU230A-100-3BMU230A-10-1BMU230A-10-2BMU230A-10-3BMU230A-15BMU230A-15-1BMU230A-15-2BMU230A-15-3BMU230A-20BMU230A-200BMU230A-200-1BMU230A-200-2BMU230A-200-3BMU230A-20-1BMU230A-20-2BMU230A-20-3BMU230A-30BMU230A-30-1BMU230A-30-2BMU230A-30-3BMU230A-5BMU230A-50BMU230A-50-1BMU230A-50-2BMU230A-50-3BMU230A-5-1BMU230A-5-2BMU230A-5-3BMU230A-ABMU230A-A-1BMU230A-A-2BMU230A-A-3BMU230A-ACBMU230A-AC-1BMU230A-AC-2BMU230A-AC-3BMU230AP-10BMU230AP-100BMU230AP-100-1BMU230AP-100-2BMU230AP-100-3BMU230AP-10-1BMU230AP-10-2BMU230AP-10-3BMU230AP-15BMU230AP-15-1BMU230AP-15-2BMU230AP-15-3BMU230AP-20BMU230AP-200BMU230AP-200-1BMU230AP-200-2BMU230AP-200-3BMU230AP-20-1BMU230AP-20-2BMU230AP-20-3BMU230AP-30BMU230AP-30-1BMU230AP-30-2BMU230AP-30-3BMU230AP-5BMU230AP-50BMU230AP-50-1BMU230AP-50-2BMU230AP-50-3BMU230AP-5-1BMU230AP-5-2BMU230AP-5-3BMU230AP-ABMU230AP-A-1BMU230AP-A-2BMU230AP-A-3BMU230AP-ACBMU230AP-AC-1BMU230AP-AC-2BMU230AP-AC-3BMU230C-10BMU230C-100BMU230C-100-1BMU230C-100-2BMU230C-100-3BMU230C-10-1BMU230C-10-2BMU230C-10-3BMU230C-15BMU230C-15-1BMU230C-15-2BMU230C-15-3BMU230C-20BMU230C-200BMU230C-200-1BMU230C-200-2BMU230C-200-3BMU230C-20-1BMU230C-20-2BMU230C-20-3BMU230C-30BMU230C-30-1BMU230C-30-2BMU230C-30-3BMU230C-5BMU230C-50BMU230C-50-1BMU230C-50-2BMU230C-50-3BMU230C-5-1BMU230C-5-2BMU230C-5-3BMU230C-ABMU230C-A-1BMU230C-A-2BMU230C-A-3BMU230C-ACBMU230C-AC-1BMU230C-AC-2BMU230C-AC-3BMU230CP-10BMU230CP-100BMU230CP-100-1BMU230CP-100-2BMU230CP-100-3BMU230CP-10-1BMU230CP-10-2BMU230CP-10-3BMU230CP-15BMU230CP-15-1BMU230CP-15-2BMU230CP-15-3BMU230CP-20BMU230CP-200BMU230CP-200-1BMU230CP-200-2BMU230CP-200-3BMU230CP-20-1BMU230CP-20-2BMU230CP-20-3BMU230CP-30BMU230CP-30-1BMU230CP-30-2BMU230CP-30-3BMU230CP-5BMU230CP-50BMU230CP-50-1BMU230CP-50-2BMU230CP-50-3BMU230CP-5-1BMU230CP-5-2BMU230CP-5-3BMU230CP-ABMU230CP-A-1BMU230CP-A-2BMU230CP-A-3BMU230CP-ACBMU230CP-AC-1BMU230CP-AC-2BMU230CP-AC-3BMU260A-ABMU260A-A-1BMU260A-A-2BMU260A-A-3BMU260A-ACBMU260A-AC-1BMU260A-AC-2BMU260A-AC-3BMU260AP-ABMU260AP-A-1BMU260AP-A-2BMU260AP-A-3BMU260AP-ACBMU260AP-AC-1BMU260AP-AC-2BMU260AP-AC-3BMU260C-ABMU260C-A-1BMU260C-A-2BMU260C-A-3BMU260C-ACBMU260C-AC-1BMU260C-AC-2BMU260C-AC-3BMU260CP-ABMU260CP-A-1BMU260CP-A-2BMU260CP-A-3BMU260CP-ACBMU260CP-AC-1BMU260CP-AC-2BMU260CP-AC-3BMU460SA-10BMU460SA-100BMU460SA-100-1BMU460SA-100-2BMU460SA-100-3BMU460SA-10-1BMU460SA-10-2BMU460SA-10-3BMU460SA-15BMU460SA-15-1BMU460SA-15-2BMU460SA-15-3BMU460SA-20BMU460SA-200BMU460SA-200-1BMU460SA-200-2BMU460SA-200-3BMU460SA-20-1BMU460SA-20-2BMU460SA-20-3BMU460SA-30BMU460SA-30-1BMU460SA-30-2BMU460SA-30-3BMU460SA-5BMU460SA-50BMU460SA-50-1BMU460SA-50-2BMU460SA-50-3BMU460SA-5-1BMU460SA-5-2BMU460SA-5-3BMU460SAP-10BMU460SAP-100BMU460SAP-100-1BMU460SAP-100-2BMU460SAP-100-3BMU460SAP-10-1BMU460SAP-10-2BMU460SAP-10-3BMU460SAP-15BMU460SAP-15-1BMU460SAP-15-2BMU460SAP-15-3BMU460SAP-20BMU460SAP-200BMU460SAP-200-1BMU460SAP-200-2BMU460SAP-200-3BMU460SAP-20-1BMU460SAP-20-2BMU460SAP-20-3BMU460SAP-30BMU460SAP-30-1BMU460SAP-30-2BMU460SAP-30-3BMU460SAP-5BMU460SAP-50BMU460SAP-50-1BMU460SAP-50-2BMU460SAP-50-3BMU460SAP-5-1BMU460SAP-5-2BMU460SAP-5-3BMU460SC-10BMU460SC-100BMU460SC-100-1BMU460SC-100-2BMU460SC-100-3BMU460SC-10-1BMU460SC-10-2BMU460SC-10-3BMU460SC-15BMU460SC-15-1BMU460SC-15-2BMU460SC-15-3BMU460SC-20BMU460SC-200BMU460SC-200-1BMU460SC-200-2BMU460SC-200-3BMU460SC-20-1BMU460SC-20-2BMU460SC-20-3BMU460SC-30BMU460SC-30-1BMU460SC-30-2BMU460SC-30-3BMU460SC-5BMU460SC-50BMU460SC-50-1BMU460SC-50-2BMU460SC-50-3BMU460SC-5-1BMU460SC-5-2BMU460SC-5-3BMU460SCP-10BMU460SCP-100BMU460SCP-100-1BMU460SCP-100-2BMU460SCP-100-3BMU460SCP-10-1BMU460SCP-10-2BMU460SCP-10-3BMU460SCP-15BMU460SCP-15-1BMU460SCP-15-2BMU460SCP-15-3BMU460SCP-20BMU460SCP-200BMU460SCP-200-1BMU460SCP-200-2BMU460SCP-200-3BMU460SCP-20-1BMU460SCP-20-2BMU460SCP-20-3BMU460SCP-30BMU460SCP-30-1BMU460SCP-30-2BMU460SCP-30-3BMU460SCP-5BMU460SCP-50BMU460SCP-50-1BMU460SCP-50-2BMU460SCP-50-3BMU460SCP-5-1BMU460SCP-5-2BMU460SCP-5-3BMU5120A-10BMU5120A-100BMU5120A-100-1BMU5120A-100-2BMU5120A-100-3BMU5120A-10-1BMU5120A-10-2BMU5120A-10-3BMU5120A-15BMU5120A-15-1BMU5120A-15-2BMU5120A-15-3BMU5120A-20BMU5120A-200BMU5120A-200-1BMU5120A-200-2BMU5120A-200-3BMU5120A-20-1BMU5120A-20-2BMU5120A-20-3BMU5120A-30BMU5120A-30-1BMU5120A-30-2BMU5120A-30-3BMU5120A-5BMU5120A-50BMU5120A-50-1BMU5120A-50-2BMU5120A-50-3BMU5120A-5-1BMU5120A-5-2BMU5120A-5-3BMU5120A-ABMU5120A-A-1BMU5120A-A-2BMU5120A-A-3BMU5120A-ACBMU5120A-AC-1BMU5120A-AC-2BMU5120A-AC-3BMU5120AP-10BMU5120AP-100BMU5120AP-100-1BMU5120AP-100-2BMU5120AP-100-3BMU5120AP-10-1BMU5120AP-10-2BMU5120AP-10-3BMU5120AP-15BMU5120AP-15-1BMU5120AP-15-2BMU5120AP-15-3BMU5120AP-20BMU5120AP-200BMU5120AP-200-1BMU5120AP-200-2BMU5120AP-200-3BMU5120AP-20-1BMU5120AP-20-2BMU5120AP-20-3BMU5120AP-30BMU5120AP-30-1BMU5120AP-30-2BMU5120AP-30-3BMU5120AP-5BMU5120AP-50BMU5120AP-50-1BMU5120AP-50-2BMU5120AP-50-3BMU5120AP-5-1BMU5120AP-5-2BMU5120AP-5-3BMU5120AP-ABMU5120AP-A-1BMU5120AP-A-2BMU5120AP-A-3BMU5120AP-ACBMU5120AP-AC-1BMU5120AP-AC-2BMU5120AP-AC-3BMU5120C-10BMU5120C-100BMU5120C-100-1BMU5120C-100-2BMU5120C-100-3BMU5120C-10-1BMU5120C-10-2BMU5120C-10-3BMU5120C-15BMU5120C-15-1BMU5120C-15-2BMU5120C-15-3BMU5120C-20BMU5120C-200BMU5120C-200-1BMU5120C-200-2BMU5120C-200-3BMU5120C-20-1BMU5120C-20-2BMU5120C-20-3BMU5120C-30BMU5120C-30-1BMU5120C-30-2BMU5120C-30-3BMU5120C-5BMU5120C-50BMU5120C-50-1BMU5120C-50-2BMU5120C-50-3BMU5120C-5-1BMU5120C-5-2BMU5120C-5-3BMU5120C-ABMU5120C-A-1BMU5120C-A-2BMU5120C-A-3BMU5120C-ACBMU5120C-AC-1BMU5120C-AC-2BMU5120C-AC-3BMU5120CP-10BMU5120CP-100BMU5120CP-100-1BMU5120CP-100-2BMU5120CP-100-3BMU5120CP-10-1BMU5120CP-10-2BMU5120CP-10-3BMU5120CP-15BMU5120CP-15-1BMU5120CP-15-2BMU5120CP-15-3BMU5120CP-20BMU5120CP-200BMU5120CP-200-1BMU5120CP-200-2BMU5120CP-200-3BMU5120CP-20-1BMU5120CP-20-2BMU5120CP-20-3BMU5120CP-30BMU5120CP-30-1BMU5120CP-30-2BMU5120CP-30-3BMU5120CP-5BMU5120CP-50BMU5120CP-50-1BMU5120CP-50-2BMU5120CP-50-3BMU5120CP-5-1BMU5120CP-5-2BMU5120CP-5-3BMU5120CP-ABMU5120CP-A-1BMU5120CP-A-2BMU5120CP-A-3BMU5120CP-ACBMU5120CP-AC-1BMU5120CP-AC-2BMU5120CP-AC-3BMU5200A-ABMU5200A-A-1BMU5200A-A-2BMU5200A-A-3BMU5200A-ACBMU5200A-AC-1BMU5200A-AC-2BMU5200A-AC-3BMU5200AP-ABMU5200AP-A-1BMU5200AP-A-2BMU5200AP-A-3BMU5200AP-ACBMU5200AP-AC-1BMU5200AP-AC-2BMU5200AP-AC-3BMU5200C-ABMU5200C-A-1BMU5200C-A-2BMU5200C-A-3BMU5200C-ACBMU5200C-AC-1BMU5200C-AC-2BMU5200C-AC-3BMU5200CP-ABMU5200CP-A-1BMU5200CP-A-2BMU5200CP-A-3BMU5200CP-ACBMU5200CP-AC-1BMU5200CP-AC-2BMU5200CP-AC-3BMU5400S-ABMU5400S-A-1BMU5400S-A-2BMU5400S-A-3BMU5400S-ACBMU5400S-AC-1BMU5400S-AC-2BMU5400S-AC-3BMU5400SP-ABMU5400SP-A-1BMU5400SP-A-2BMU5400SP-A-3BMU5400SP-ACBMU5400SP-AC-1BMU5400SP-AC-2BMU5400SP-AC-3BMU6200SA-10BMU6200SA-100BMU6200SA-100-1BMU6200SA-100-2BMU6200SA-100-3BMU6200SA-10-1BMU6200SA-10-2BMU6200SA-10-3BMU6200SA-15BMU6200SA-15-1BMU6200SA-15-2BMU6200SA-15-3BMU6200SA-20BMU6200SA-200BMU6200SA-200-1BMU6200SA-200-2BMU6200SA-200-3BMU6200SA-20-1BMU6200SA-20-2BMU6200SA-20-3BMU6200SA-30BMU6200SA-30-1BMU6200SA-30-2BMU6200SA-30-3BMU6200SA-5BMU6200SA-50BMU6200SA-50-1BMU6200SA-50-2BMU6200SA-50-3BMU6200SA-5-1BMU6200SA-5-2BMU6200SA-5-3BMU6200SAP-10BMU6200SAP-100BMU6200SAP-100-1BMU6200SAP-100-2BMU6200SAP-100-3BMU6200SAP-10-1BMU6200SAP-10-2BMU6200SAP-10-3BMU6200SAP-15BMU6200SAP-15-1BMU6200SAP-15-2BMU6200SAP-15-3BMU6200SAP-20BMU6200SAP-200BMU6200SAP-200-1BMU6200SAP-200-2BMU6200SAP-200-3BMU6200SAP-20-1BMU6200SAP-20-2BMU6200SAP-20-3BMU6200SAP-30BMU6200SAP-30-1BMU6200SAP-30-2BMU6200SAP-30-3BMU6200SAP-5BMU6200SAP-50BMU6200SAP-50-1BMU6200SAP-50-2BMU6200SAP-50-3BMU6200SAP-5-1BMU6200SAP-5-2BMU6200SAP-5-3BMU6200SC-10BMU6200SC-100BMU6200SC-100-1BMU6200SC-100-2BMU6200SC-100-3BMU6200SC-10-1BMU6200SC-10-2BMU6200SC-10-3BMU6200SC-15BMU6200SC-15-1BMU6200SC-15-2BMU6200SC-15-3BMU6200SC-20BMU6200SC-200BMU6200SC-200-1BMU6200SC-200-2BMU6200SC-200-3BMU6200SC-20-1BMU6200SC-20-2BMU6200SC-20-3BMU6200SC-30BMU6200SC-30-1BMU6200SC-30-2BMU6200SC-30-3BMU6200SC-5BMU6200SC-50BMU6200SC-50-1BMU6200SC-50-2BMU6200SC-50-3BMU6200SC-5-1BMU6200SC-5-2BMU6200SC-5-3BMU6200SCP-10BMU6200SCP-100BMU6200SCP-100-1BMU6200SCP-100-2BMU6200SCP-100-3BMU6200SCP-10-1BMU6200SCP-10-2BMU6200SCP-10-3BMU6200SCP-15BMU6200SCP-15-1BMU6200SCP-15-2BMU6200SCP-15-3BMU6200SCP-20BMU6200SCP-200BMU6200SCP-200-1BMU6200SCP-200-2BMU6200SCP-200-3BMU6200SCP-20-1BMU6200SCP-20-2BMU6200SCP-20-3BMU6200SCP-30BMU6200SCP-30-1BMU6200SCP-30-2BMU6200SCP-30-3BMU6200SCP-5BMU6200SCP-50BMU6200SCP-50-1BMU6200SCP-50-2BMU6200SCP-50-3BMU6200SCP-5-1BMU6200SCP-5-2BMU6200SCP-5-3BMU6400SS-10BMU6400SS-10-1BMU6400SS-10-2BMU6400SS-10-3BMU6400SS-15BMU6400SS-15-1BMU6400SS-15-2BMU6400SS-15-3BMU6400SS-20BMU6400SS-20-1BMU6400SS-20-2BMU6400SS-20-3BMU6400SS-30BMU6400SS-30-1BMU6400SS-30-2BMU6400SS-30-3BMU6400SS-5BMU6400SS-50BMU6400SS-50-1BMU6400SS-50-2BMU6400SS-50-3BMU6400SS-5-1BMU6400SS-5-2BMU6400SS-5-3BMU6400SSP-10BMU6400SSP-10-1BMU6400SSP-10-2BMU6400SSP-10-3BMU6400SSP-15BMU6400SSP-15-1BMU6400SSP-15-2BMU6400SSP-15-3BMU6400SSP-20BMU6400SSP-20-1BMU6400SSP-20-2BMU6400SSP-20-3BMU6400SSP-30BMU6400SSP-30-1BMU6400SSP-30-2BMU6400SSP-30-3BMU6400SSP-5BMU6400SSP-50BMU6400SSP-50-1BMU6400SSP-50-2BMU6400SSP-50-3BMU6400SSP-5-1BMU6400SSP-5-2BMU6400SSP-5-3BMUD120-ABMUD120-A2BMUD120-CBMUD120-C2BMUD200-ABMUD200-CBMUD30-ABMUD30-A2BMUD30-CBMUD30-C2BMUD400-SBMUD60-ABMUD60-A2BMUD60-CBMUD60-C2",,https://www.orientalmotor.com/products/pdfs/2012-2013/D/BMU-Series-Brochure.pdf,Brushless DC Motor,,https://ntntech.vn/en/motor-and-drivers/brushless-dc-motor/oriental-motor-bmu-series-brushless-dc-motors/
Oriental Motor US series,"The US series combines a speed control motor and a control unit. The capacitor and the potentiometer have been integrated into one compact control unit. The series is designed for applications where remote control of the motor speed and easy hookup are required. Features●Control units combine the control pack, potentiometer and the capacitor in one device. Capacitors for US560 and US590 types are externally fitted with leads and capacitor caps.Connection between motor and control unit is simplified by a special connector.●Use of the optional extension cable allows for remote control of the motor from a distance of up to 15.6 feet.(4.75m).●Variable speed range is 90r/min ~ 1400r/min (50Hz), 90r/min~1600r/min (60Hz). Specification Specifications (Motor) — Continuous Rating  General Specifications  Order Code  Model List",,/wp-content/uploads/2023/04/Oriental-Motor-US-series-catalog.pdf,Speed control motors,,https://ntntech.vn/en/motor-and-drivers/speed-ctrl-motor-en/oriental-motor-us-series-2/
