product_name,description_1,description_2,download_link,Categories,Brands,URL
DTRY-ELB Series,"Remove Static Electricity in Electronics Production Ion Transport by Tubing or Metal Piping Nozzle Types: Shower, Flat, Bar, L -shaped Optional Controller Available Specification  Order Code  Model List",,https://www.ntntech.com.vn/cm-ionizer-blow-type/1165-dtry-elb-ionizer.html,Ionizers,,https://ntntech.vn/en/pneumatics/ionizers/dtry-elb-series/
"Festo MS-LFR, MS series Filter regulators","The MS series offers the widest variety of filter regulator units, ideal for every application.The filter unit offers good particle separation at high flow rates. The pressure regulator has good control characteristics with low hysteresis. A return flow function and a secondary vent are integrated as standard in the MS series.The filter regulator can be installed as a module in service units according to the simple modular system of the MS series. Four sizes offer a wide flow rate spectrum.The housings are made of die-cast aluminum, the filter bowls are optionally made of metal or polycarbonate with bowl guard and can be combined with all condensate drain systems.The MS-LFR filter regulators are optionally configurable for use in hazardous areas of zones 1, 2, 21 and 22 as well as with UL approval.",,/wp-content/uploads/2023/09/Festo-MS-LFR-MS-series-datasheet.pdf,FRL Combination,,https://ntntech.vn/en/pneumatics/frl-combination/festo-ms-lfr-ms-series-filter-regulators-2/
SMC Booster Regulator VBA,"Can increase factory air by a maximum of 200%, Power supply not requiredIt is possible to get a maximum of double the existing pressure by connecting the air to a factory line.(VBA11A: maximum 4 times)Space-saving type that directly connects air tanks and booster regulators Specification  The IN air passes through the check valve to booster chambers A and B. Meanwhile, air is supplied to drive chamber B via the governor andthe switching valve. Then, the air pressure from drive chamber B and booster chamber A are applied to the piston, boosting the air in boosterchamber B. As the piston travels, the boosted air is pushed via the check valve to the OUT side. When the piston reaches to the end, the pistoncauses the switching valve to switch, so that drive chamber B is in the exhaust state and drive chamber A is in the supply state respectively.Then, the piston reverses its movement, this time, the pressures from booster chamber B and drive chamber A boosts the air in boosterchamber A and sends it to the OUT side. The process described above is repeated to continuously supply highly pressurized air from the IN tothe OUT side. The governor establishes the outlet pressure by knob operation and pressure adjustment in the drive chamber by feeding back theoutlet pressure.  Order Code  Model List VBA10A-02 VBA20A-03 VBA40A-04 VBA22A-03 VBA42A-04 VBA43A-04 VBA11A-02 G27-20-01 G36-10-01 KT-VBA22A-7 AN20-02 AN30-03 AN40-04 ",,https://ca01.smcworld.com/catalog/en/frl/VBA-E/7-8-4-p1271-1306-VBA_en/data/7-8-4-p1271-1306-VBA_en.pdf,FRL Combination,,https://ntntech.vn/en/pneumatics/frl-combination/smc-booster-regulator-vba/
"Koganei FR150, FR300, FR600 Filter regulators","●A 5μ m air filter and a small regulator are combined into a compact body.●Pressure gauge with preset marker is standard equipment.●Model for low pressure and model with built-in check mechanism alsoincorporated into the series.●Drain cock with fitting, and auto drain type drain cock, are optional. Specification   Order Code  Model List FR150-01 FR150-02 FR300-02 FR300-02-A FR300-03-A FR600-02-02 FR600-03-A FR600-04-A",,,FRL Combination,,https://ntntech.vn/en/pneumatics/frl-combination/koganei-fr150-fr300-fr600-filter-regulators-2/
Asahi Gauge 101-A / 101-B / 101-D series Pressure gauge,"Pressure gauge Asahi Gauge series 101 , Bourdon Tube. 101-A bottom thread 101-B bottom thread with gasket 101-D: back connection thread Application：General, steam (M), heatproof (H), vibration-proof (V), vibration-proof for steam (MV),heat- &vibration-proof (HV).Material：Copper alloyClasses of precision：1.0,1.6 Size mặt đồng hồ áp suất, type , ren kết nối và dãy áp suất đo như bảng dưới 0.05MPa～200MPaVacuum Model List ",,http://mail.asahigauge.co.jp/english/products/pdf/1010.pdf,Pressure Gauge,,https://ntntech.vn/en/pneumatics/other-pneumatic-components/pressure-gauge/asahi-gauge-101-a-101-b-101-d-series-pressure-gauge/
Nagano Keiki JM Pressure Gauge with Electric Contact,"This pressure gauge with electric contacts incorporating mechanical switch function. ON/OFF electrical switch action utilizes Buzzer, Bell, Pilot lamp warning system and motor, pump and control valve process control. Specification",,https://products.naganokeiki.co.jp/userfiles/files/products/JM__/E-JM____O_8P20220531.pdf,Pressure Gauge,,https://ntntech.vn/en/pneumatics/other-pneumatic-components/pressure-gauge/nagano-keiki-jm-pressure-gauge-with-electric-contact/
Wika Model 55 Bimetal thermometer,"Scale ranges from -70 … +600 °C [-94 … +1,112 °F] For extreme ambient temperatures Maintenance-friendly bayonet case Completely from stainless steel Individual stem length from 63 … 1,000 mm [2.5 … 39 in]  Specification The model 55 bimetal thermometer has been developed and is manufactured in accordance with the EN 13190 standard. This high-quality thermometer has been designed especially for the requirements of the process industry. Especially in the chemical and petrochemical, oil and gas, and power engineering industries, the temperature measuring instrument completely manufactured from stainless steel is used successfully. The model 55 satisfies the high requirements for resistance against aggressive media. As an option, the case can be made from 316L to fulfil the highest requirements. To allow optimum fitting to the process, individual insertion lengths and different process connections can be selected. When it comes to harsh climatic conditions at the place of use, the model 55 is the right choice, as it can be used at temperatures ranging from -40 °C [-40 °F] to +70 °C [+158 °F] (optionally also up to -50 °C [-58 °F] or -70 °C [-94 °F] in the POLARgauge®version).",,https://www.wika.com/media/Data-sheets/Temperature/Dial-thermometers/ds_tm5501_en_co.pdf,Pressure Gauge,,https://ntntech.vn/en/pneumatics/other-pneumatic-components/pressure-gauge/wika-model-55-bimetal-thermometer/
SMC G(A)36 Pressure Gauge,"SMC offers a variety of pressure gauges including general purpose, oil-free/external parts copper-free with limit indicator, clean series and a pressure gauge with a pressure switch. Pressure ranges vary from 0 to 1.5MPa, depending on the selected gauge. General purpose pressure gauge w/limit indicator Back side or vertical side thread Pressure range: 0 to 1.5MPa (0 to 225psi) Indication precision: ±3% F.S. (full span)",,https://ca01.smcworld.com/catalog/en/silencer_blow_gauge/G_-E/6-7-p0870-0891-g_en/data/6-7-p0870-0891-g_en.pdf,Pressure Gauge,,https://ntntech.vn/en/pneumatics/other-pneumatic-components/pressure-gauge/smc-ga36-pressure-gauge/
SMC Auto Switch D Seires,Order Code  ,,https://ca01.smcworld.com/catalog/en/actuator/D-AS1-E/6-2-1-p1576-1673-sw2mu-yuu_en/data/6-2-1-p1576-1673-sw2mu-yuu_en.pdf,Sensor Switch,,https://ntntech.vn/en/pneumatics/other-pneumatic-components/sensor-switch/d-series-smc-auto-switch-2/
Koganei KSHJ series Shock absorber,NTN Technology Company offer KSHJ series Shock absorber with Koganei maker Specification   Model List,,,Shock Absorber,,https://ntntech.vn/en/pneumatics/other-pneumatic-components/shock-absorber/koganei-kshj-series-shock-absorber/
FA series Fuji Latex Shock absorber,NTN Technology Company offer FA series Shock absorber with Maker Fuji Latex Model List,,https://fujilatex.actibookone.com/content/detail?param=eyJjb250ZW50TnVtIjo2ODAzNn0=&detailFlg=1&pNo=1,Shock Absorber,,https://ntntech.vn/en/pneumatics/other-pneumatic-components/shock-absorber/fa-series-fuji-latex-shock-absorber/
EXEN UP-A UP-S Plastic Ball Vibrator,"01Food plant: prevention of blockage in chute in raw meat conveyance line 02Prevention of blockage in pot noodle additive conveyance chute 03Improvement of buildup of workpiece ejected in screw production line. Improvement of buildup of cutting workpiece ejected. Improvement of resin moulding cutout workpiece ejected (1)Plastic ball vibrator has body made of plastic and is excellent in corrosion resistance. The vibration principle is easy, in which a steel ball rotates at high speed to generate powerful vibration. Because this ball vibrator with the simple principle and structure can be used easily, it is helpful for an area where minor vibration is required or for preventing clogging in hopper or chute. (During operation, it is necessary to supply lubricant with an oiler.)(2)UP-A series is a successor to the conventional UP series, for which the previous design is remodeled, and all the installation dimensions are the same. The vibration force is also almost the same, which maintains compatibility.(3)UP1 series include models UP110A and UP113A, UP2 series include models UP219A, UP3 series include models UP335A, which total 4 models (Successor to the conventional UP4 series is dropped from production.)(4)Model UP-S series is a new product. As compared to the same model as the model UP-A (Example: comparison between UP113A and UP113S), the amplitude is nearly double the value, which is a small powerful type. There are 2 models available: models UP113S and UP219S. A steel ball that rotates at high speed inside the housing with compressed air generates strong centrifugal vibration.Simply operating the pressure of compressed air allows frequency and centrifugal force to be easily changed.※ Use a lubricator (Oiler) to maintain its performance. Since the body is made of reinforced plastic, it has excellent corrosion resistance and is suitable for use in high humidity environments where rust is likely to occur. The smallest UP110A with the mounting width of 31 mm and the weight of 0.24 kg enables installation in narrow spaces where it is difficult to install a conventional vibrator. Ball can be replaced in all models.Replacement maintenance can be easily conducted by loosening bolts on the side cover, removing the side cover, and the replacing the ball.(Note: If the internal raceway ring is significantly worn, only replacing the ball will not repair the product) Although the ball vibrator is generally used to prevent minor clogging of powder in hopper or chute, it can be utilized as a motor for vibration table used for filling.Applications are expanded on various ideas, such as applying the vibration to eliminate buildup in parts supply line of production lines. All models of ball vibrator are provided with mounting holes for the fall prevention wire.It is highly recommended to mount the wire to ensure the safety in plant. (Wire is optional) Model UP-S is a powerful type with large amplitude.This series generates about double the amplitude compared to the UP-A series. As a result, the ability is used in an environment where large equipment installation spaces are insufficient while requiring powerful vibrations. CA1 type is a control panel for the manual pneumatic vibrator, which provides easy operation for the pneumatic vibrator and ball vibrator, and piston vibrator.Preparing only air tube and pressure air allows quick operation. Specification","https://www.exen.co.jp/english/industry/image/Top01_UP_eng.jpg, https://www.exen.co.jp/english/industry/image/Top02_UP_eng.jpg, https://www.exen.co.jp/english/industry/image/Top03_UP_eng.jpg, https://www.exen.co.jp/english/industry/image/Top04_UP_eng.jpg, https://www.exen.co.jp/english/industry/image/Top05_UP_eng.jpg, https://www.exen.co.jp/english/industry/image/Top06_UP_eng.jpg, https://www.exen.co.jp/english/industry/image/Top07_UP_eng.jpg, https://www.exen.co.jp/english/industry/image/Top08_UP_eng.jpg",,Pneumatic vibrator,,https://ntntech.vn/en/pneumatics/other-pneumatic-components/pneumatic-vibrator/exen-up-a-up-s-plastic-ball-vibrator/
EXEN BH CH UH Series Ball vibrator,"Compact pneumatic vibrator in a wide range of models and expanded applications This product is used for the following applications: 01Milling plant: installation to small screening machine made by user 02Prevention of blockage in sodium chloride conveyance chute 03Improvement of buildup of workpiece ejected in screw production line. Improvement of buildup of cutting workpiece ejected. Improvement of resin moulding cutout workpiece ejected Ball vibrator is a compact vibrator that generates powerful centrifugal force vibration via high-speed rotation of steel ball by compressed air. This vibrator has simple principle and structure and can be used easily. It is generally used for preventing clogging in hopper chute, but the applications are expanded depending on ideas. Frequency and centrifugal force can be freely changed only by operation of air pressure. Depending on the on-site installation conditions, selection can be made from model lineup of BH-A, CH-A, and UH-A, which are different in positions of air supply and exhaust. (Supplying lubricant with an oiler is required) A steel ball that rotates at high speed inside the housing with compressed air generates strong centrifugal vibration. Simply operating the pressure of compressed air allows frequency and centrifugal force to be easily changed. ※ Use a lubricator (Oiler) to maintain its performance. The smallest BH8 with the mounting width of 18 mm and the weight of 0.3 kg enables installation in narrow spaces where it is difficult to install a conventional vibrator. (BH8 type can be installed in two directions.) Depending on the on-site installation conditions, selection can be made from model lineup of BH-A, CH-A, and UH-A, which are different in positions of air supply and exhaust. This series can be also used in water because of its high airtightness. (Assuming that exhaust pipe is extended to the atmosphere) Since the intake direction differs depending on the model, it is possible to select the model according to the piping restrictions of the air tube. BH type that can be installed with a single bolt is also available. The waterproof structure of this series enables use in watery environments. By attaching a tube connector to the exhaust port (replace the silencer with a tube connector) and extending the intake and exhaust hoses, this vibrator can be attached to an underwater object. (Note: If the exhaust tube is extended, the vibration efficiency will decrease.) Ball can be replaced in all models. Replacement maintenance can be easily conducted by loosening bolts on the side cover, removing the side cover, and the replacing the ball. (Note: If the internal raceway ring is significantly worn, only replacing the ball will not repair the product) Although the ball vibrator is generally used to prevent minor clogging of powder in hopper or chute, it can be utilized as a motor for vibration table used for filling. Applications are expanded on various ideas, such as applying the vibration to eliminate buildup in parts supply line of production lines. All models of ball vibrator are provided with mounting holes for the fall prevention wire. It is highly recommended to mount the wire to ensure the safety in plant. (Wire is optional) CA1 type is a control panel for the manual pneumatic vibrator, which provides easy operation for the pneumatic vibrator and ball vibrator, and piston vibrator. Preparing only air tube and pressure air allows quick operation. Timer control panel VSE1 corresponds to input power supply AC100V / AC200V. This is a control panel dedicated to the solenoid valve that controls the operating time and the rest time. Specification （Imperial System） *Use the product in ambient temperature of 80°C or more.*The above specification is the result under measurement condition of EXEN. The actual data may differ from the above specification depending on the installation conditions.*Pressure required to start may become higher than motion pressure, because the former pressure is a pressure when starting up with the pressure gradually risen at a position 3cm before the vibrator.* Vertical indicates a direction in which a boll rotates vertically, and Horizontal indicates the result of installation with a boll rotates in planar direction. If the installation angle is other than vertical, starting pressure shows a lower trend than vertical.","https://www.exen.co.jp/english/industry/image/Top01_BHCH_eng.jpg, https://www.exen.co.jp/english/industry/image/Top02_BHCH_eng.jpg, https://www.exen.co.jp/english/industry/image/Top03_BHCH_eng.jpg, https://www.exen.co.jp/english/industry/image/Top04_BHCH_eng.jpg, https://www.exen.co.jp/english/industry/image/Top04_UP_eng.jpg, https://www.exen.co.jp/english/industry/image/Top05_UP_eng.jpg, https://www.exen.co.jp/english/industry/image/Top05_BHCH_eng.jpg, https://www.exen.co.jp/english/industry/image/Top08_UP_eng.jpg, https://www.exen.co.jp/english/industry/image/Top06_BHCH_eng.jpg",,Pneumatic vibrator,,https://ntntech.vn/en/pneumatics/other-pneumatic-components/pneumatic-vibrator/exen-bh-ch-uh-series-2/
SMC Speed Controllers Type AS,"・Easy to lock push-lock type・Larger knob・Improved tube insertion/removalInsertion force: Max. 30% (8 N) reductionRemoval force: Max. 20% (5 N) reduction** Tube removal strength is ensured to be equivalent to the previous model.・Electroless nickel plated type is standard.・360°swivel piping is possible. (Universal type)・Restrictor (Made to Order : -X214, -X21)・Large Flow Type (-X778) Specification  Order Code ",,,Speed control valve,,https://ntntech.vn/en/pneumatics/speed-control-valve/smc-speed-controllers-type-as/
Keyence PZ-G Photoelectric sensor,,,,Photoelectric sensor,,https://ntntech.vn/en/sensors/photoelectric-sensor/keyence-pz-g-photoelectric-sensor/
Omron E2K-X series Cylindrical Proximity Sensor,,,https://www.ia.omron.com/data_pdf/cat/e2k-x_ds_e_9_2_csm460.pdf?id=471,Proximity Sensor,,https://ntntech.vn/en/sensors/proximity-sensor/omron-e2k-x-series-cylindrical-proximity-sensor/
Keyence LV-S series Ultra-small Digital Laser Sensor,Compact size Transparent object detection (available) Zero datum function (available) Specification Back to top Back to top Back to top Back to top Back to top,,,Laser sensor,,https://ntntech.vn/en/sensors/laser-sensor/keyence-lv-s-series-ultra-small-digital-laser-sensor/
Panasonic FX-500 Ver.2 Digital Fiber Sensor,"The Industry’s Leading Fiber Amplifier In Sensing Performance, FX-500 Series Thanks to its new “application-specific integrated circuit” (ASIC), Panasonic can solve applications with Fiber Optic Sensors that were previously impossible. Not only can the FX-500 Series reach a response time of 25µs while providing extremely accurate detection, integrated logic functions save you money because external controllers are no longer needed for normal applications and threshold tracking and self-diagnostic functions save time for maintenance. Moreover, the reliability of the detection has increased by 75% compared to that of previous models. Users can choose between digital output types with one or two outputs, or an analog output type. Model List",,,Fiber sensor,,https://ntntech.vn/en/sensors/fiber-sensor/panasonic-fx-500-ver-2-digital-fiber-sensor-2/
SICK WLL180T Fiber-optic sensors,"Selectable response time up to 16 µs Sensing range up to 20 m (through-beam system); up to 1,400 mm (proximity system) Bus-compatible with anti-interference 2 x 4-digit digital display Adjustable hysteresis Rotatable display screen High-resolution signal processing Programmable time delays Specification  0 mm … 1,000 mm, Through-beam system1)3) 0 m … 6 m, Through-beam system2)4)  Single teach-in button Cable 1)Sensing range with 8 ms response time. Reduction with shorter response time (see tables LL3/WLL180T). 2)LL3-TX01. 3)LL3-TW01. 4)Sensing range with 200 ms response time. Reduction with shorter response time (see tables LL3/WLL180T). 5)With correctly attached fibre-optic cable LL3 and closed protection hood. Model List WLL180T-F434 Part no.: 6039102WLL180T-F232 Part no.: 6039098WLL180T-M434 Part no.: 6039101WLL180T-P432 Part no.: 6039093WLL180T-N434 Part no.: 6039096WLL180T-M674 Part no.: 6064432WLL180T-E434 Part no.: 6039104WLL180T-M333S01 Part no.: 6041000WLL180T-M432S01 Part no.: 6041508WLL180T-F333 Part no.: 6042429WLL180T-F232S01 Part no.: 6041509WLL180T-N432S01 Part no.: 6041639WLL180T-L432 Part no.: 6039099WLL180T-E232 Part no.: 6039100WLL180T-L434 Part no.: 6039103WLL180T-M333 Part no.: 6042428WLL180T-P474 Part no.: 6039618WLL180T-N474 Part no.: 6039619WLL180T-N432 Part no.: 6039094WLL180T-P434 Part no.: 6039095WLL180T-M434S16 Part no.: 6062149WLL180T-P432S06 Part no.: 6048130WLL180T-M634S11 Part no.: 6050776WLL180T-M434S07 Part no.: 6049025",,,Fiber sensor,,https://ntntech.vn/en/sensors/fiber-sensor/sick-wll180t-fiber-optic-sensors/
Omron E6C3-C Rotary Encoder,"• Incremental model • External diameter of 50 mm. • Resolution of up to 3,600 ppr. • IP65 (improved oil-proof construction with sealed bearings) • Superior shaft loading performance (radial: 80 N, thrust: 50 N) Specification Model List   Accessories (Order Separately)",,https://www.ia.omron.com/data_pdf/cat/e6c3-c_ds_e_7_2_csm495.pdf?id=1335,Enconder,,https://ntntech.vn/en/sensors/enconder/omron-e6c3-c-rotary-encoder/
Takex SS20 Series Slim type Light Curtain Sensors,Beam interval: 20 Anti Interference feature for parallel installation (M/S switching) Longest-in-class detecting distance of 7m Application Detection of hole or tear in opaque sheet Wide area sensor equipped with one-axis output and all-axis output modes provides the detection of a hole or tear by activating the output when light is received in one or more axis. Model List,"https://www.takex-elec.co.jp/uploads/Product/1772/OptionProduct_Pic_SS-H5.jpg, https://www.takex-elec.co.jp/uploads/Product/1773/OptionProduct_Pic_SS-H10.jpg",,Safety Light Curtains,,https://ntntech.vn/en/sensors/safety-sensor/safety-light-curtains-en/takex-ss20-series-slim-type-light-curtain-sensors/
Panasonic LX-100 series Digital Mark Sensor,"The LX-100 Series – a combined LED contrast and color Sensor – can be used both as a high-speed contrast sensor to quickly and reliably detect printer’s marks, for example, and as a high-precision color Sensor. In contrast sensing mode, the Sensor automatically selects the optimum emitting LED during teach-in (static or dynamic teach-in method) from the transmitting light source (red, green and blue LEDs). With a response time of just 45µs, this Sensor is perfect for high processing speeds like those required in printing presses, for example. In color mode, an integrated microprocessor with a 12-bit A/D converter digitally processes the signals of the color to be detected in red, green and blue primary color components. This ensures that even the most minute color differences or merest of tints can be accurately distinguished. Characteristics Three Different Emitting LEDs (Red, Green, Blue) High Precision Coaxial Reflective Optical System High Resolution 12-Bit A/D Converter 4-Digit Digital Display Teach-In For Simple Settings (External Teaching Also Possible) Timer Function (ON/OFF-Delay) Two Inverse Outputs (Cable Type) Compact Size M12 Or Cable Type IP67 Specification  Model List",,,Color sensor,,https://ntntech.vn/en/sensors/color-sensor/panasonic-lx-100-series-digital-mark-sensor-2/
Keyence GT2 series High-Accuracy Digital Contact Sensor,"The Scale Shot System in the GT2 Series improves upon the technology of conventional contact sensors and is now concentrated into a pencil-type sensor head. Specification Specification The sensor head – including the connector and cable section – are IP67G and NEMA Type 13 compliant. This means that stable measurement is achieved even in harsh environments containing splashing water or oil. In order to improve robustness – a common problem with contact sensors – careful attention was paid to the structure of the sensor body. The design incorporates a high-strength linear ball bearing and a seamless body for additional durability. In addition, the reduced weight of the spindle means minimal wear from friction and significantly improved durability. These design improvements reduce maintenance and equipment downtime.",,,Measurement Sensors,,https://ntntech.vn/en/sensors/measurement-sensors-en/keyence-gt2-series-high-accuracy-digital-contact-sensor-2/
