product_name,description_1,description_2,download_link,Categories,Brands,URL
Koganei Air Hand AFDPG Flat type,The flat-type air hand with linear guides to increase accuracy and rigidity adopts a double piston method to achieve larger gripping force. Select from synchronous/ non-synchronous/ and long types according to workpiece requirements. The thin figure achieves height of 15mm in case of 6mm between the body surface and guides and 37mm in case of 18mm between the body surface and guides; while an option can be selected with stroke adjusting mechanism (in both opening and closing directions) for all models.Bore size 6mm/8mm/12mm/14mm/18mmStroke12-80mmEffective gripping force From12N{1.2kgf} at 6mm to 105N {10.7kgf} at 18mm Specification ,,https://official.en.koganei.co.jp/downloader/catalog/AFDPG/1,Air Gripper,,https://ntntech.vn/en/pneumatics/air-cylinder/air-gripper/koganei-air-hand-afdpg-2/
Koganei NHBDSL / NHBDSLG 180 Degree Open/Close,Φ12 to 25 mm [0.472 to 0.984 in] cylinder bore size. 180 degree finger type. Perfect for chucking and handling. Φ12 to 20 mm [0.472 to 0.787 in] cylinder bore size. 180 degree open/close type. Employs a thrust bearing for high accuracy and high rigidity. Perfect for workpiece escape. Specification    Order Code   ,,https://official.en.koganei.co.jp/downloader/catalog/NHBDSLG_ALL/1,Air Gripper,,https://ntntech.vn/en/pneumatics/air-cylinder/air-gripper/koganei-nhbdsl-nhbdslg-2/
Koganei NHBDPGL Parallel type with linear guide,Bore size: Φ8 to 20 mm [0.315 to 0.787 in] cylinder bore. Linear guide equipped high-rigidity air hand that is perfect for chucking and handling. Specification  Order Code ,,https://official.en.koganei.co.jp/downloader/catalog/NHBDPGL_ALL/1,Air Gripper,,https://ntntech.vn/en/pneumatics/air-cylinder/air-gripper/koganei-nhbdpgl-parallel-type-with-linear-guide/
Koganei NHBDPG Parallel type with linear guide,Koganei NHBDPG Parallel type with linear guide : Double acting type & single acting type Φ8 to 32 mm [0.315 to 1.26 in] cylinder bore. Linear guide equipped high-rigidity air hand that is perfect for chucking and handling. Specification  Order Code ,,https://official.en.koganei.co.jp/downloader/catalog/NHBDPG/1,Air Gripper,,https://ntntech.vn/en/pneumatics/air-cylinder/air-gripper/koganei-nhbdpg-parallel-type-with-linear-guide/
Koganei NHC1 Series Parallel type Air Hand,"Φ10 to 25 mm [0.394 to 0.984 in] cylinder bore size. Perfect for high rigidity and high accuracy chucking and handling. 40% lighter, 45% smaller than previous models. Specification  Order Code ",,https://official.en.koganei.co.jp/downloader/catalog/NHC1D_ALL/1,Air Gripper,,https://ntntech.vn/en/pneumatics/air-cylinder/air-gripper/koganei-nhc1-series-parallel-type-air-hand/
NKE CHP230 series Air chuck,"Compact, parallel chuck with large grip and opening allowance. The CHP230 series is available in 6 sizes, large and small, with 2 opening allowances, and horizontal and vertical finger orientations. For types with a small opening allowance for each model, a dust seal is attached to the sliding part of the rod to take dustproof measures. A non-contact type small magnetic proximity switch can be installed directly into the T-groove without popping out of the body. Specification * 1: Grip force is the value at the tip of the finger when the working pressure is 0.5Mpa {5.1kgf / cm²}.Please check the grip force calculation formula table below for the calculation formula.* 2, * 3: This is a rough reference value and varies depending on the usage conditions. Grip force calculation formula table: open, closed (N) P: Working pressure (MPa)ℓ: Length of claw from finger tip to center of gravity of work (cm) Order Code ",,https://nke.co.jp/product/catalog/pdf/chp230.pdf,Air Gripper,,https://ntntech.vn/en/pneumatics/air-cylinder/air-gripper/nke-chp230-series-air-chuck/
CKD FH100 Feather hand,"Lightweight, small, and compact.[Operating stroke length] 8, 11, 14, 18, 20 mm [Integrated compact body]Cylinder integrated structure adopted, realizing simplicity. [Open / close confirmation switch]2 proximity switches can be installed. Specification  Order Code  Model List FH110-D FH112-D FH116-D FH120-D FH125-D",,https://www.ckd.co.jp/kiki/en/file/4809,Air Gripper,,https://ntntech.vn/en/pneumatics/air-cylinder/air-gripper/ckd-fh100-feather-hand/
SMC MHC2 Standard Type Angular Type Air Gripper,A large holding moment is achieved through a double piston construction. Integral variable throttle Specification  Order Code  Model List MHC2-10D MHC2-16D MHC2-20D MHC2-25D MHC2-10S MHC2-16S MHC2-20S MHC2-25S,,https://content2.smcetech.com/pdf/mhc.pdf,Air Gripper,,https://ntntech.vn/en/pneumatics/air-cylinder/air-gripper/smc-mhc2-standard-type-angular-type-air-gripper-2/
SMC MHF2 series Low Profile Air Gripper,"・Reduced height of approx. 1/3 of that of the standard gripper・Low profile design that reduces moment generation・Short, middle, and long strokes are available.・Compact, but the double piston mechanism provides it with a stronggripping force. Specification  Order Code   Model List Double acting type MHF2-8DMHF2-8D1MHF2-8D2MHF2-12DMHF2-12D1MHF2-12D2MHF2-16DMHF2-16D1MHF2-16D2MHF2-20DMHF2-20D1MHF2-20D2",,https://content2.smcetech.com/pdf/MHF2_EU.pdf,Air Gripper,,https://ntntech.vn/en/pneumatics/air-cylinder/air-gripper/smc-mhf2-series-low-profile-air-gripper/
Festo ADN-S/AEN-S Compact cylinder,Minimal fitting space Extra light Ideal for small movements Piston rod with internal or external thread Magnetic piston for position sensing Variants recommended for production facilities for the manufacture of lithium-ion batteries Sustainable in production due to reduction of material use Specification  Order Code  Model List,,https://www.festo.com/media/pim/539/D15000100140539.PDF,Compact cylinder,,https://ntntech.vn/en/pneumatics/air-cylinder/compact-cylinder/festo-adn-s-aen-s-compact-cylinder/
SMC CDQ2-Z series Compact cylinders,Order Code ,,https://content2.smcetech.com/pdf/CQ2_Z.pdf,Compact cylinder,,https://ntntech.vn/en/pneumatics/air-cylinder/compact-cylinder/smc-cdq2-z-series-compact-cylinders/
SMC Metal Seal MQQ Low Friction Cylinders,・Covers a range of driving speeds and output controls not possible with standard cylinders thanks to its metal seal structure with minimal sliding resistance.  Specification  Order Code ,https://vietfa.com.vn/wp-content/uploads/2020/09/MQQ-mo-ta.png,https://ca01.smcworld.com/catalog/en/actuator/MQQ-MQM-MQP-E/6-2-3-p0317-0344-mq_en/data/6-2-3-p0317-0344-mq_en.pdf,Compact cylinder,,https://ntntech.vn/en/pneumatics/air-cylinder/compact-cylinder/smc-metal-seal-mqq-low-friction-cylinders/
SMC MU/MDU series Plate cylinder,"・The oval piston design saves space. Cylinders can bemounted from multiple directions.・It is possible to mount small auto switches in 4 directions.・No protrusion of the auto switch from the mounting slot・Available with a stroke of up to 300 mm・With auto switch (MDU series: MDU, MDUW) Specification  Order Code  Model List",,https://ca01.smcworld.com/catalog/en/actuator/MU-MDU-Z-E/6-2-1-p1033-1060-mu-z_en/data/6-2-1-p1033-1060-mu-z_en.pdf,Compact cylinder,,https://ntntech.vn/en/pneumatics/air-cylinder/compact-cylinder/smc-mu-mdu-series-plate-cylinder/
Koganei BDA series Multi mount cylinders,"This Series provides OEM customers the most compact body design along with non-rotating rod specifications. Mounting options provide flexibility to orient this cylinder to your design rather than changing your design because of a component. The Selection Guide provides a summary of the 18 different BDA / HBDA Series Multi Mount Cylinders Offer: High Degree of Parallel and Perpendicular Accuracy Combination of a Square and Compact Body Non-rotating Types Available 4 Surface Mounting Options 3 Sensor Types Optional RoHS Compliance OperationsDouble Acting Non-RotatingSingle Acting PullSingle Acting Pull Non-RotatingSingle Acting PushSingle Acting Push Non-Rotating Specification  Model List Double acting type● Φ6 to 16 mm [0.236 to 0.630 in] cylinder bore. A square and compact body, and mounting brackets provides plenty of mounting versatility. Single acting push out type● Φ6 to 16 mm [0.236 to 0.630 in] cylinder bore. A square and compact body, and mounting brackets provides plenty of mounting versatility. Single acting type with integrated return spring. Single acting pull● Φ6 to 16 mm [0.236 to 0.630 in] cylinder bore. A square and compact body, and mounting brackets provides plenty of mounting versatility. Single acting type with integrated return spring. Non-rotating double acting type● Φ6 to 16 mm [0.236 to 0.630 in] cylinder bore. Non-rotating type meets a wide variety of high non-rotating accuracy needs. All in a square and compact body. Single acting non-rotating push out type● Φ6 to 16 mm [0.236 to 0.630 in] cylinder bore. Single acting type with non-rotating type integrated return spring. Meets a wide variety of high non-rotating accuracy needs. All in a square and compact body. Single acting non-rotating pull type● Φ6 to 16 mm [0.236 to 0.630 in] cylinder bore. Single acting type with non-rotating type integrated return spring. Meets a wide variety of high non-rotating accuracy needs. All in a square and compact body. Double acting double rod type● Φ6 to 16 mm [0.236 to 0.630 in] cylinder bore. A square and compact body, and mounting brackets provides plenty of mounting versatility. Cylinder with piston rods on both ends of the piston. Non-rotating double acting double rod type● Φ6 to 16 mm [0.236 to 0.630 in] cylinder bore. Non-rotating double rod type. Meets a wide variety of high non-rotating accuracy needs. All in a square and compact body.",,https://official.en.koganei.co.jp/downloader/catalog/BDA/1,Compact cylinder,,https://ntntech.vn/en/pneumatics/air-cylinder/compact-cylinder/koganei-bda-series-cylinders/
Koganei Jig cylinder C series,,,https://official.en.koganei.co.jp/downloader/catalog/CDA/2,Compact cylinder,,https://ntntech.vn/en/pneumatics/air-cylinder/compact-cylinder/koganei-jig-cylinder-c-series-2/
Free Mount Cylinder CU/CDU,"・Space-saving cylinder that enables the direct mounting of cylinderson multiple sides・With auto switch (CDU series: CDU, CDUW, CDUK, CDUKW, CDU-A,ZCDUK) Specification  Order Code  Model List Model list",,https://ca01.smcworld.com/catalog/en/actuator/CU-CDU-E/6-2-1-p0619-0685-cu_en/index.html#target/page_no=1,Compact cylinder,,https://ntntech.vn/en/pneumatics/air-cylinder/compact-cylinder/free-mount-cylinder-cu-cdu/
Compact cylinder CKD SSD2 series compact cylinder,"The CKD SSD2 compact cylinder is part of a space-saving series designed by CKD Corporation. It’s a versatile, double-acting pneumatic cylinder suitable for a wide range of applications, from general industrial environments to specialized uses. Here’s a quick rundown based on what’s known about it: Design: It’s a super-compact cylinder with a square body, offering a shorter overall length compared to traditional models. This makes it ideal for equipment where space is at a premium. Features:Cylinder switch grooves on four surfaces (except for bore sizes φ12 and φ16), allowing a switch to be mounted on the same side as the piping port for better visibility and maintenance.Rod end options include a standard female thread or an optional male thread.Compatible with CKD’s T-type switches across all bore sizes, which helps streamline inventory. Cylinder switch grooves on four surfaces (except for bore sizes φ12 and φ16), allowing a switch to be mounted on the same side as the piping port for better visibility and maintenance. Rod end options include a standard female thread or an optional male thread. Compatible with CKD’s T-type switches across all bore sizes, which helps streamline inventory. Stroke Lengths: Offers a wide range of stroke lengths and switch mounting options, customizable to specific needs. Applications: Works in everything from clean rooms to dusty or welding environments, with variations like heat-resistant or high-durability models (e.g., SSD2-HP1 for long life or SSD2-G-HP1 for harsh, dusty conditions). Bore Sizes: Available in multiple sizes (e.g., φ20 to φ100+), with specifics like the SSD2-L-63D-15 model having a 63mm bore and 15mm stroke. Specification  Order Code  Model List SSD-L-50-25-T0H-D",,,Compact cylinder,,https://ntntech.vn/en/pneumatics/air-cylinder/compact-cylinder/ckd-ssd2-compact-cylinder-2/
Koganei CDA Jig Cylinder,"This is our original compact block cylinder series that continues to be a reliable option for many OEM customers with 15 model variations. The Selection Guide provides a summary of the 650 different CDA Series Jig Cylinder variations available in Basic Models, Low Friction Models and Stroke Adjustable Models. The extensive CDA Series Jig Cylinders offer: Bore Sizes from 6mm to 100mm Rod Thread Option Male & Female Integrated End of Stroke Lock Non-ion Versions Available Utilizes Standard Integrated 4mm Sensor Groove RoHS Compliance Specification  Order Code ",,https://official.en.koganei.co.jp/downloader/catalog/CDA_ALL/1,Compact cylinder,,https://ntntech.vn/en/pneumatics/air-cylinder/compact-cylinder/cda-series-jig-cylinders/
CKD SCA2 Medium bore size air cylinder,"Medium bore size standard cylinders (ø40 to ø100) with the end covers fixed with tie rod on both sides. Wide range of choices. The most reliable series in the standard cylinders Easy to modify to the type with switchThe cylinder is equipped with a magnet as standard, allowing modification to the type with switch by simply mounting the desired sensor switch.Simple replacement of the mounting bracket The adapter compatible with different mounting brackets enables easy replacement and helps efficient inventory management.Lighter weight and higher corrosion resistanceAluminum main parts including both end covers, piston and tube have enabled the lighter body with higher corrosion resistance and shock resistance. Specification  Order Code ",,/wp-content/uploads/2023/11/SCA2-Series-Catalog3MB.pdf,Round cylinder,,https://ntntech.vn/en/pneumatics/air-cylinder/round-cylinder/ckd-sca2-air-cylinder/
Metalwork RNDC Stainless steel round cylinders,Specification Specification ,,,Round cylinder,,https://ntntech.vn/en/pneumatics/air-cylinder/round-cylinder/metalwork-rndc-stainless-steel-round-cylinders-2/
"Festo DSNU Round cylinder, double-acting",Wide range of variants for customised applications Good running performance and long service life Self-adjusting pneumatic end-position cushioning saves time during commissioning and adapts optimally to load and speed changes Piston rod with female or male thread For position sensing,,https://www.festo.com/media/pim/155/D15000100122155.PDF,Round cylinder,,https://ntntech.vn/en/pneumatics/air-cylinder/round-cylinder/festo-dsnu-round-cylinder-2/
CKD SCPS・SCPD3・SCPS3・SCPH3 Pencil shaped cylinder,"The lightest miniature series with the smallest bore size (φ6 to φ16) among general purpose cylinders. Space saving with compact standard switch ”T Series”. Compatible with the discontinued conventional product SCP*2 Series. [Compact design]Miniature bore size φ6, φ10, φ16.Total length is also short in pursuit of compactness. [Compact cylinder switch keeps it even smaller]Height is reduced by half with compact cylinder switch ”T Series”. Specification Specification and Order code",,https://www.ckd.co.jp/kiki/en/file/16915,Round cylinder,,https://ntntech.vn/en/pneumatics/air-cylinder/round-cylinder/ckd-scps-scpd3-scps3-scph3/
SMC CM2/CDM2 series Air Cylinder,"・Female rod end is available as standard.・Easy fine adjustment of auto switch position・Single clevis and trunnion pivot brackets are available.・Part numbers with a rod end bracket and/or pivot bracket are available.(It is not necessary to order a bracket for the applicable cylinder separately.)・With auto switch (CDM2-Z series: CDM2, CDM2W, CDM2K, CDM2KW,CDM2R, CDM2RK, CDM2□P, CDBM2) Specification Model List CDM2B32-250AZ",,https://ca01.smcworld.com/catalog/en/actuator/CM2-CDM2-Z-E/6-2-1-p0167-0267-cm2_en/data/6-2-1-p0167-0267-cm2_en.pdf,Round cylinder,,https://ntntech.vn/en/pneumatics/air-cylinder/round-cylinder/smc-cm2-cdm2-series-cylinder/
SMC CJ2/CDJ2 series Air cylinder,"・Double foot and head flange have been added to the available mounting types.・Easy fine adjustment of auto switch position・The auto switch mounting type, band, or rail can be selected with the model number.・Part numbers with a rod end bracket and/or pivot bracket are available.(It is not necessary to order a bracket for the applicable cylinder separately.)・With auto switch (CDJ2-Z series: CDJ2, CDJ2W, CDJ2K, CDJ2Z, CDJ2ZW, CDJ2RA, CDJ2RK)",,https://ca01.smcworld.com/catalog/en/actuator/CJ2-CDJ2-Z-E/6-2-1-p0041-0152-cj2_en/data/6-2-1-p0041-0152-cj2_en.pdf,Round cylinder,,https://ntntech.vn/en/pneumatics/air-cylinder/round-cylinder/smc-cj2-cdj2-series/
SMC CJP Pin Cylinder,"Single acting, spring return, pin cylinder Compact design-minimizes mounting space Three bore sizes available Strokes from 5mm to 15mm available Two mounting styles available",,https://content2.smcetech.com/pdf/cjp.pdf,Round cylinder,,https://ntntech.vn/en/pneumatics/air-cylinder/round-cylinder/smc-cjp-pin-cylinder/
Koganei DA series Slim cylinders,"Koganei DA series Slim cylinders The stainless-steel tubing linear round body cylinder series provides OEM customers an extensive lineup of options to meet almost anyapplication.Improve the performance and reduce the size of your next generation machine. Koganei sets the standard for supplying innovative high-qualitysolutions with unmatched reliability. Optimized designs, with a wide variety of styles and sizes, increase speed to market as well as providesolutions for most applications. Expedite deliveries with product stocked in the USA.KOGANEI is committed to your success from concept, to initial design, to final delivery and beyond. Specification ",,https://official.en.koganei.co.jp/downloader/catalog/DA/1,Round cylinder,,https://ntntech.vn/en/pneumatics/air-cylinder/round-cylinder/koganei-da-series-slim-cylinders/
Koganei PBDAS series Pen cylinders,"The PBDAS series includes the smallest diameter linear round body cylinders in the world (with bore sizes as small as 2.5mm), which allow machine and tool designers to miniaturize devices, machines, and automated processes. The Selection Guide provides a summary of the 45 different Pen Cylinder model variations available. PBDA Series Pen Cylinders offer: Bore Sizes from 2.5mm to 16mm High Temperature Operation Integrated Speed Control Option Stroke Adjustment Option Stainless Steel Tubes RoHS Compliance Operations Specification  Model List Double acting type● Φ6 to 16 mm [0.236 to 0.630 in] cylinder bore. Complies with all model non-ion standards. Compact, light weight, and more durable. Used in manufacturing lines in a wide range of industries. Single acting push out type● Φ6 to 16 mm [0.236 to 0.630 in] cylinder bore. Complies with all model non-ion standards. Single acting type with integrated return spring. Single acting pull● Φ6 to 16 mm [0.236 to 0.630 in] cylinder bore. Complies with all model non-ion standards. Single acting type with integrated return spring. Non-rotating double acting type● Φ10 to 16 mm [0.394 to 0.630 in] cylinder bore size. Compatible with all model non-ion standards. Hexagon type non-rotating piston rod. Single acting non-rotating push out type● Φ10 to 16 mm [0.394 to 0.630 in] cylinder bore size. Compatible with all model non-ion standards. Single acting type with hexagon type non-rotating piston rod, and integrated return spring. Single acting non-rotating pull type● Φ10 to 16 mm [0.394 to 0.630 in] cylinder bore size. Compatible with all model non-ion standards. Single acting type with hexagon type non-rotating piston rod, and integrated return spring. Double acting double rod type● Φ10 to 16 mm [0.394 to 0.630 in] cylinder bore size. Compatible with all model non-ion standards. Cylinder with piston rods on both ends of the piston. Double acting push stroke adjustment type● Φ10 to 16 mm [0.394 to 0.630 in] cylinder bore size. Compatible with all model non-ion standards. Cylinder with stroke limiting stopper. Double acting pull stroke adjustment type● Φ10 to 16 mm [0.394 to 0.630 in] cylinder bore size. Compatible with all model non-ion standards. Cylinder with stroke limiting stopper. Double acting type heat resistant type● Φ6 to 16 mm [0.236 to 0.630 in] cylinder bore. Fluorine packing enables operating temperatures up to 150 degrees. However, a sensor switch cannot be equipped. Low hydraulic pressure: Double acting type● Φ6 to 16 mm [0.236 to 0.630 in] cylinder bore. Pneumatic-hydraulic converter can be used for simple low-speed operation control of a cylinder operated by low hydraulic pressure.",,https://official.en.koganei.co.jp/downloader/catalog/PBDA/1,Round cylinder,,https://ntntech.vn/en/pneumatics/air-cylinder/round-cylinder/pen-cylinders-pbda-series-2/
Festo DFM metric series Guided drive,Drive and guide unit in a single housing High resistance to torques and lateral forces Plain or recirculating ball bearing guide Wide variety of mounting and attachment options Wide range of variants for customised applications Variants recommended for production systems for manufacturing lithium-ion batteries,,https://www.festo.com/media/pim/979/D15000100121979.PDF,Guide cylinder,,https://ntntech.vn/en/pneumatics/air-cylinder/guide-cylinder/festo-dfm-metric-series-guided-drive/
CKD STG series Guided cylinder,"Lighter weight / resource saving. In addition, the guide rod bearing section is improved and the metal bearing material and bearing structure are modified. This improves the lateral load proof characteristics, realizing stable operation. Specification  Order Code ",,https://www.ckd.co.jp/kiki/en/file/4668,Guide cylinder,,https://ntntech.vn/en/pneumatics/air-cylinder/guide-cylinder/ckd-stg-series-guided-cylinder-2/
Koganei MGT series Mini Guide Table,"Integration of compact, high-precision, high rigidity table, guide, and cylinder. Uses a 4-point contact linear guide. Metal stopper equipped as standard, shock absorber also equipped. Specification  Order Code ",,https://official.en.koganei.co.jp/downloader/catalog/MGT_ALL/1,Guide cylinder,,https://ntntech.vn/en/pneumatics/air-cylinder/guide-cylinder/koganei-mgt-series-mini-guide-table-2/
SMC MXQ series Air Slide Table,・Height: 10% reduction (27 mm: Current model 30 mm)・Product weight: 22% reduction (298 g: Current model 380 g)・Allowable kinetic energy: 64% improvement(0.09 J: Current model 0.055 J) Specification   Order Code  Model List MXQ16-125AS MXQ8L-10CS ,,https://content2.smcetech.com/pdf/MXQ.pdf,Guide cylinder,,https://ntntech.vn/en/pneumatics/air-cylinder/guide-cylinder/smc-mxq-series-air-slide-table/
SMC MXH series Compact Slide,・Allowable moment improved by up to 240%・With new high rigidity linear guideAllowable moment improved・The weight has been reduced by incorporatinga new high rigidity linear guide and piston.Weight: 19% reduction (ø20-10 stroke)・Piping is possible in 3 directions. Specification  Order Code  Model List MXH model,,https://content2.smcetech.com/pdf/MXH-B_EU.pdf,Guide cylinder,,https://ntntech.vn/en/pneumatics/air-cylinder/guide-cylinder/smc-mxh-series-compact-slide/
Koganei MGA series Mini guide sliders cylinder,"The Stainless Steel tabletop of each unit is heat treated and ground for a precision finish. A 4-point contact linear guide is integrated directlyinto the body. A locating dowel pin hole provides quick installation.Improve the performance and reduce the size of your next generation machine. Koganei sets the standard for supplying innovative high-qualitysolutions with unmatched reliability. Optimized designs, with a wide variety of styles and sizes, increase speed to market as well as providesolutions for most applications. Specification  Order Code ",,https://official.en.koganei.co.jp/downloader/catalog/MGA/1,Guide cylinder,,https://ntntech.vn/en/pneumatics/air-cylinder/guide-cylinder/koganei-mga-series-mini-guide-sliders-cylinder/
Koganei SGDA series Jig Cylinder with Guides,"These compact cylinders with dual heavy-duty guides can be used in a variety of applications where side-loading is a concern. Multiplemounting arrangements and piping directions simplify installation.Improve the performance and reduce the size of your next generation machine. Koganei sets the standard for supplying innovative high-qualitysolutions with unmatched reliability. Optimized designs, with a wide variety of styles and sizes, increase speed to market as well as providesolutions for most applications. Expedite deliveries with product stocked in the USA.KOGANEI is committed to your success from concept, to initial design, to final delivery and beyond. Specification  Order Code ",,https://official.en.koganei.co.jp/downloader/catalog/SGDA/2,Guide cylinder,,https://ntntech.vn/en/pneumatics/air-cylinder/guide-cylinder/koganei-sgda-series-2/
SMC MGPK Compact Guide Cylinder,Specification      Order Code Vui lòng xem hướng dẫn model code như bên dưới Model code,https://www.smcworld.com/upfiles/series/6008/img1-MGPK.jpg,http://ca01.smcworld.com/catalog/New-products-en/mpv/es20-270-MGPK/data/es20-270-MGPK.pdf,Guide cylinder,,https://ntntech.vn/en/pneumatics/air-cylinder/guide-cylinder/compact-guide-cylinder-mgpk-2/
